{
  "gegenereerdOp": "2026-10-26T10:11:39.501Z",
  "valuta": "EUR",
  "inclBtw": true,
  "omschrijving": "Gemiddelde pompprijs van benzine (Euro95) en diesel in Nederland (CBS), per liter, incl. btw en accijns: het gemiddelde van de laatste 30 dagen en per maand.",
  "bron": {
    "naam": "CBS StatLine, Pompprijzen motorbrandstoffen",
    "tabel": "80416NED",
    "url": "https://opendata.cbs.nl/#/CBS/nl/dataset/80416NED/table",
    "licentie": "CC BY 4.0"
  },
  "laatste": {
    "van": "2026-09-20",
    "tot": "2026-10-19",
    "dagen": 30,
    "benzinePerLiter": 2.44,
    "dieselPerLiter": 2.502
  },
  "maanden": [
    {
      "maand": "2025-11",
      "dagen": 30,
      "benzinePerLiter": 1.956,
      "dieselPerLiter": 1.769
    },
    {
      "maand": "2025-12",
      "dagen": 31,
      "benzinePerLiter": 1.91,
      "dieselPerLiter": 1.705
    },
    {
      "maand": "2026-01",
      "dagen": 31,
      "benzinePerLiter": 2.014,
      "dieselPerLiter": 1.801
    },
    {
      "maand": "2026-02",
      "dagen": 28,
      "benzinePerLiter": 2.039,
      "dieselPerLiter": 1.834
    },
    {
      "maand": "2026-03",
      "dagen": 31,
      "benzinePerLiter": 2.249,
      "dieselPerLiter": 2.294
    },
    {
      "maand": "2026-04",
      "dagen": 30,
      "benzinePerLiter": 2.323,
      "dieselPerLiter": 2.412
    },
    {
      "maand": "2026-05",
      "dagen": 31,
      "benzinePerLiter": 2.378,
      "dieselPerLiter": 2.282
    },
    {
      "maand": "2026-06",
      "dagen": 30,
      "benzinePerLiter": 2.232,
      "dieselPerLiter": 2.083
    },
    {
      "maand": "2026-07",
      "dagen": 31,
      "benzinePerLiter": 2.315,
      "dieselPerLiter": 2.231
    },
    {
      "maand": "2026-08",
      "dagen": 31,
      "benzinePerLiter": 2.333,
      "dieselPerLiter": 2.369
    },
    {
      "maand": "2026-09",
      "dagen": 30,
      "benzinePerLiter": 2.448,
      "dieselPerLiter": 2.499
    },
    {
      "maand": "2026-10",
      "dagen": 19,
      "benzinePerLiter": 2.433,
      "dieselPerLiter": 2.48
    }
  ]
}
